{
  "$schema": "http://json-schema.org/draft-07/schema#",
  "title": "ExecutionReceipt",
  "type": "object",
  "properties": {
    "$schema": {
      "type": "string"
    },
    "wave_id": {
      "type": "string"
    },
    "status": {
      "type": "string",
      "enum": ["complete", "failed", "killed"]
    },
    "environment": {
      "type": "string",
      "enum": ["local-mac", "headless-vm"],
      "description": "Where this wave was executed."
    },
    "branch": {
      "type": ["string", "null"],
      "description": "Git branch name (e.g. 'wave/fix-observer-polling'). Null if patch-only."
    },
    "branch_policy": {
      "type": "string",
      "enum": ["wave-branch", "patch-only", "direct-main"],
      "description": "How the wave's output was delivered."
    },
    "git_commit": {
      "type": ["string", "null"],
      "description": "HEAD commit SHA after wave completion. Null if patch-only or no code changed."
    },
    "diff_stat": {
      "type": "object",
      "properties": {
        "files_changed": {
          "type": "integer",
          "minimum": 0
        },
        "insertions": {
          "type": "integer",
          "minimum": 0
        },
        "deletions": {
          "type": "integer",
          "minimum": 0
        }
      },
      "required": ["files_changed", "insertions", "deletions"],
      "additionalProperties": false
    },
    "patch_file": {
      "type": ["string", "null"],
      "description": "Path to .patch file relative to repo root. Null if direct-main."
    },
    "test_verdict": {
      "type": "string",
      "enum": ["PASS", "FAIL", "NOT_RUN"]
    },
    "token_burn": {
      "type": "object",
      "properties": {
        "input": {
          "type": "integer",
          "minimum": 0
        },
        "output": {
          "type": "integer",
          "minimum": 0
        }
      },
      "required": ["input", "output"],
      "additionalProperties": false
    },
    "blocker_reason": {
      "type": ["string", "null"]
    },
    "kill_reason": {
      "type": ["string", "null"],
      "enum": [null, "budget-exceeded", "timeout", "scope-violation", "attempt-limit", "environment-ceiling", "manual"],
      "description": "Structured kill reason when status is 'killed'. Null otherwise."
    },
    "attempts_used": {
      "type": "integer",
      "minimum": 0,
      "description": "Number of code-modifying attempts consumed (recon passes excluded)."
    },
    "discoveries": {
      "type": "array",
      "items": {
        "type": "object",
        "properties": {
          "symbol_or_behavior": {
            "type": "string"
          },
          "file": {
            "type": "string"
          }
        },
        "required": ["symbol_or_behavior", "file"],
        "additionalProperties": false
      },
      "maxItems": 5,
      "description": "Falsifiable technical discoveries from this wave: new exported symbols, unmapped edge cases, quirky runtime behaviors - each anchored to an exact file path. No prose lessons, no generic statements. Feeds the nightly reflection's knowledge capture. KILL CONDITION: if empty or padded with fluff after 10 waves carrying this field (count from 2026-10-04), strip the key from the schema."
    }
  },
  "required": [
    "wave_id",
    "status",
    "environment",
    "branch_policy",
    "git_commit",
    "diff_stat",
    "patch_file",
    "test_verdict",
    "blocker_reason",
    "attempts_used"
  ],
  "additionalProperties": false
}
