{"$schema":"./schemas/execution_receipt.schema.json","wave_id":"factory-receipt-protocol","status":"complete","environment":"local-mac","branch":null,"branch_policy":"direct-main","git_commit":"5f2a089","diff_stat":{"files_changed":5,"insertions":98,"deletions":0},"patch_file":".factory/diffs/factory-receipt-protocol.patch","test_verdict":"NOT_RUN","token_burn":{"input":185402,"output":28407},"blocker_reason":null,"kill_reason":null,"attempts_used":1}